{
  "schema_version": "1.0",
  "profile_id": "WEB-FASTAPI-REACT-KEYCLOAK-PG",
  "profile_version": "2.0.0",
  "certified_at": "2026-08-21",
  "runtime": "docker",
  "containers_executed": true,
  "complete_gate": true,
  "passed": true,
  "profile_sha256": "d94304c724099975842e0a1b5c2c55cd8bf4070e6cf7d083bc23249ff4bc23ab",
  "driver_sha256": "bcdb99ef572655d7e38ea053b5afe56dd002f2d875681daeccd71a193be16598",
  "scaffold_sha256": "e6063d4c7a3ca69df2cde3a56861da79f07c059c5215c4eaf026aaf841ba0b72",
  "composition_digest": "c2b4a072422df9f5f63f0ebaacb8bf69ad3694fe0ba10bcfbd37c7cdfbd973d7",
  "certification_engine_sha256": "8d0bbb842292fb14731eafaccdd130c5643ba594f524f4975b5708e4e66b1429",
  "checks": [
    {
      "gate_id": "GATE-API-LINT",
      "status": "passed"
    },
    {
      "gate_id": "GATE-API-LOCK",
      "status": "passed"
    },
    {
      "gate_id": "GATE-API-OPENAPI",
      "status": "passed"
    },
    {
      "gate_id": "GATE-API-TEST",
      "status": "passed"
    },
    {
      "gate_id": "GATE-API-TYPECHECK",
      "status": "passed"
    },
    {
      "gate_id": "GATE-BROWSER-ACCESSIBILITY",
      "status": "passed"
    },
    {
      "gate_id": "GATE-BROWSER-SMOKE",
      "status": "passed"
    },
    {
      "gate_id": "GATE-COMPOSE-H0-WEB",
      "status": "passed"
    },
    {
      "gate_id": "GATE-DATA-INTEGRATION",
      "status": "passed"
    },
    {
      "gate_id": "GATE-DATA-MIGRATION",
      "status": "passed"
    },
    {
      "gate_id": "GATE-DELIVERY-EVIDENCE",
      "status": "passed"
    },
    {
      "gate_id": "GATE-FRONTEND-BUILD",
      "status": "passed"
    },
    {
      "gate_id": "GATE-FRONTEND-LINT",
      "status": "passed"
    },
    {
      "gate_id": "GATE-FRONTEND-LOCK",
      "status": "passed"
    },
    {
      "gate_id": "GATE-FRONTEND-TEST",
      "status": "passed"
    },
    {
      "gate_id": "GATE-FRONTEND-TYPECHECK",
      "status": "passed"
    },
    {
      "gate_id": "GATE-OCI-BUILD",
      "status": "passed"
    },
    {
      "gate_id": "GATE-OCI-SMOKE",
      "status": "passed"
    },
    {
      "gate_id": "GATE-OIDC-CONTRACT",
      "status": "passed"
    },
    {
      "gate_id": "GATE-OIDC-INTEGRATION",
      "status": "passed"
    },
    {
      "gate_id": "GATE-SCAFFOLD-INTEGRITY",
      "status": "passed"
    },
    {
      "gate_id": "GATE-STATIC-OUTPUT",
      "status": "passed"
    }
  ],
  "result_sha256": "c41ce94c777ce682eed0df92e45b645c5ea3e2c61a680357dd37fdd7f792292d",
  "command": "python scripts/run_reference_profile_gate.py --profile WEB-FASTAPI-REACT-KEYCLOAK-PG --runtime docker --containers --record-certification"
}
